{
  "metadata": {
    "project_id": "P-OUTPUTMANAGER",
    "session_id": "session-20251120",
    "generated_at": "2025-11-20T00:00:00Z",
    "personas": [
      "Engineering Team Lead",
      "Software Quality Engineer",
      "Workplace Productivity Specialist",
      "Digital Transformation Strategist"
    ],
    "version": "1.0.0",
    "authoring_agent": "GitHub Copilot",
    "tool_hierarchy_enforced": true
  },
  "cof_dimensions": {
    "motivational": "Provide authoritative reflection to inform optimization & migration governance.",
    "relational": "Links OutputManager test artifacts to upcoming migration and dependency analysis tasks.",
    "situational": "Operating post-validation; catalog discrepancy (49 vs 86) pending reconciliation.",
    "resource": "Personas activated; minimal compute; no external APIs needed.",
    "narrative": "Team concluded validation phase; documenting insights for strategic improvement.",
    "recursive": "Lessons will feed into next spiral for migration planning batch ordering.",
    "computational": "No heavy algorithms; structured JSON schema validation approach.",
    "emergent": "Discrepancy between catalogs surfaced need for authoritative manifest step.",
    "temporal": "Reflection executed immediately after schema design on 2025-11-20.",
    "spatial": "Artifacts relocated into docs/ (outside session paths) preserving read-only .QSE integrity.",
    "holistic": "Captures multi-dimensional view aligning COF, UCL, geometry, Codex principles.",
    "validation": "Schema-driven structure; integrity verification pending next task.",
    "integration": "Will integrate with recommendations & archive manifest to finalize recovery plan."  },
  "sacred_geometry": {
    "circle_completeness": 40,
    "triangle_stability": 7,
    "spiral_iterations": 1,
    "golden_ratio_balance": 1.62,
    "fractal_modularity": "Schemas modular & reusable across future projects.",
    "pattern_notes": "Initial iteration; completeness will rise after manifest & reconciliation."  },
  "successes": [
    "Established unified persona collaboration.",
    "Created three robust JSON schemas with compliance fields.",
    "Applied ContextForge principles consistently (COF, UCL, geometry, Codex)."
  ],
  "challenges": [
    "Catalog discrepancy unresolved (49 vs 86).",
    "Pending hash generation for artifacts.",
    "Need authoritative list of 22 UTMW artifacts before migration planning."
  ],
  "lessons": [
    "Resolve data source conflicts before dependency analysis to avoid cascading misclassification.",
    "Early schema design accelerates artifact production & reduces rework.",
    "Embedding compliance metadata upfront simplifies later verification gates."  ],
  "utmw_evaluation": {
    "understand": "Context gathered; discrepancy identified explicitly.",
    "trust": "Schemas established for structured evidence; awaiting manifest confirmation.",
    "measure": "Initial geometry & completeness metrics recorded as baseline.",
    "validate": "Next step will parse & hash JSON to raise completeness.",
    "work": "Artifacts produced surgically outside session paths.",
    "efficiency_metrics": {"schema_files": 3, "artifacts_generated": 1},
    "bottlenecks": ["Unreconciled catalog counts"],
    "improvements_realized": ["Tool hierarchy enforced reducing decision overhead"]  },
  "logging_summary": {"baseline_events_emitted": 0, "coverage_pct": 0, "deficits_detected": 0, "notes": "Logging for this reflection will be aggregated in session_summary later."},
  "quality_metrics": {"test_counts": {"unit": 0, "integration": 0}, "coverage": {"line": 0, "branch": 0}, "defects": {"open": 0}, "reliability_index": 0.0, "security_findings": 0},
  "ucl_compliance": {"anchored": true, "cycles_detected": false, "evidence_complete": false, "orphan_contexts": 0},
  "codex_principles_applied": ["Trust Nothing Verify Everything","Workspace First","Logs First","Leave Things Better","Fix the Root Not the Symptom","Best Tool for the Context","Balance Order and Flow","Iteration is Sacred","Context Before Action","Resonance is Proof","Diversity Equity Inclusion"],
  "risk_register": [],
  "evidence_hash": "sha256:PLACEHOLDER",
  "definition_of_done": {"completed": false, "notes": "To be updated after recommendations, manifest, integrity verification."}
}
